topik,pertanyaan
pengajuan bantuan,informasi jadwal pengajuan bantuan keuangan mengetahuinya rektorat fakultas kebijakan pengurangan uang kuliah tunggal anak beasiswa abadi brawijaya bantuannya ucapkan  hotma parlindungan nainggolan
pengajuan bantuan,pengajuan bantuan keuangan kategori pengurangan ukt tagihan ukt siam perubahan
pengajuan bantuan,sbg informasi pengumuman kelulusan hasil seleksi mandiri alih jenjang tertanggal agustus informasi terima peserta seleksi berasal vokasi potongan biaya pendidikan kategori ipi diajukan diterima sbg tgl pengajuan bantuan keuangan juli tsb tes seleksi masuk tgl tsb tgl agustus pengumuman hasil seleksi tgl agustus
pengajuan bantuan,proses pengajuan bantuan keuangan error form data inputan kolom fakultas tombol form bantuannya mengakses bantuan keuangan
pengajuan bantuan,akumulasi angsuran semester angsuran semester genap dibayarkan tanggal januari februari artinya angsuran diselesaikan pengajuan bantuan keuangan semester genap diproses bingung maksud pengajuan angsuran semester genap dibayarkan sesuai jadwal tanggal februari jadwal seminar hasil angsuran semester bayarkan februari semester studi selesai semester angsuran semester genap dibayarkan penuh kebijakan arahanya
pengajuan bantuan,sap perubahan kategori ukt pengajuan bantuan keuangan siam nominalnya perubahan
pengajuan bantuan,izin pengajuan bantuan keuangan nama fanny nugrahani ditolak perubahan siam
pengajuan bantuan,muhammad hasbi ashshiddiqi  tahap pengajuan yudisium apps kemarin pengajuan bantuan keuangan batas january surat dibawah pemberitahuan potongan ukt yudisium potong ukt kegiatan yudisium sesuai tanggal penyelesaiannya kegiatan yudisium isi surat berlaku pengajuan bantuan keuangan kemarin tgl januari surat berlaku pengajuan bantuan keuangan kemarin pengajuan bantuan keuangan informasi terkait
pengajuan bantuan,izin terkait data pengajuan bantuan keuangan nama noor leona asiyah jurusan  data ajukan masuk diterima berdasarkan hasil keputusan siam tertera keterangan data memenuhi data sebenar benarnya
pengajuan bantuan,pengajuan bantuan keuangan mengajukan pembebasan mencapai tahap selesai sidang skripsi pendaftaran yudisium siam tertulis pengajuan perubahan kelompok ukt
pengajuan bantuan,lampirkan surat pengajuan bantuan keuangan bantuannya
pengajuan bantuan,lampirkan surat pengajuan bantuan keuangan memenuhi persyaratan mengikuti uas
pengajuan bantuan,pengajuan bantuan keuangan prosedurnya diajukannya kemana
pengajuan bantuan,selamat malam izin pengajuan bantuan keuangan langkah finalisasi lakukan menunggu dipersiapkan verifikasi bem fakultas dll website sibaku gambar jadwal
pengajuan bantuan,perkenalkan nama triyo anggoro pendidikan teknologi informasi izin bantuan keuangan biaya ukt kemarin mengisi persyaratan pengajuan bantuan keuangan biaya ukt validasi diakses wassalamualaikum
bantuan ukt dan ukt kemendikbud ristek,selamat malam izin bantuan ukt kemendikbud ristek aktif baca berita bantuan kemendikbud aktif mengajukan bantuannya prosedurnya bantuan semester semester  sumber berita bantuan ukt juta kemendikbud ristek syaratnya klik bca http
bantuan ukt dan ukt kemendikbud ristek,ijin kemarin mengajukan pengangsuran siam sesuai nominal angsuran info bantuan ukt kemendikbud ristek pengajuan form jawabannya
bantuan ukt dan ukt kemendikbud ristek,menghubungi kontak beliau saya mengajukan perpanjangan studi status siam aktif mengajukan perpanjangan menunggu hasil pengajuan bantuan ukt kemendikbud ristek
bantuan ukt dan ukt kemendikbud ristek,izin bantuan ukt kemendikbud ristek semester ganjil tau pengumumannya
bantuan ukt dan ukt kemendikbud ristek,informasi pemotongan biaya ukt surat edaran kampus informasi teman terkait program biaya ukt kemendikbud ristek menuliskannya surat disayangkan memantau informasi web berharap bantuan ukt meringankan pengeluaran orang tua pandemi
bantuan ukt dan ukt kemendikbud ristek,selamat malam izin bantuan ukt kemendikbud ristek semester ganjil tau hasilnya
bantuan ukt dan ukt kemendikbud ristek,izin bantuan ukt kemendikbud ristek semester ganjil atau surat keputusannya
bantuan ukt dan ukt kemendikbud ristek,izin kalo tau bantuan ukt kemendikbud ristek semester ganjil hasilnya
pengambilan sertifikat toefl,ppkm mengurus pengambilan sertifikat toefl surat keterangan lulus terima kasih
pengambilan sertifikat toefl,proses pengambilan sertifikat toefl
pengambilan sertifikat toefl,pengambilan sertifikat toefl
pengambilan sertifikat toefl,pengambilan sertifikat toefl di masa pandemi sertifikat sertifikat mendaftar wisuda
pengambilan sertifikat toefl,santo janoski angkatan terkait proses pengambilan sertifikat toefl isi formnya berulang kali tanggal dikatakan salah isi tanggal ujian toeflnya ujian toefl tgl januari ujian toefl surabaya konseling bukti tiket kereta tgl januari januari psikiater rumah sakit tiket pulang malang tgl januari selesai ujian toefl langsung toefl itp dimana tertera tanggal seandainya salah tanggal ujian toefl bantuannya
pengambilan sertifikat toefl,pengambilan sertifikat toefl kompetensi mengambil sertifikat
pengambilan sertifikat toefl,benedict abednego hasibuan seputar pengambilan sertifikat toefl mekanisme pengambilan pandemi ppkm mekanisme tertera link https
pengambilan sertifikat toefl,mas akbar bantuannya prosedur pengambilan sertifikat toefl
pengambilan sertifikat toefl,perihal pengambilan sertifikat toefl pandemi pengambilan sertifikatnya online kampus
pengambilan sertifikat toefl,permisi prosedur pengambilan sertifikat toefl fakultas
pengambilan sertifikat toefl,min min info pengambilan sertifikat toefl testnya udah mei cuman sertifkatnya belom diambil infonya
pengambilan sertifikat toefl,form pengambilan sertifikat toefl mengisi tanggal tes lupa tanggal tesnya mengeceknya dimana
pengambilan sertifikat toefl,mengisi form pengambilan sertifikat toefl besok langsung diambil konfirmasi
pengambilan sertifikat toefl,pengambilan sertifikat toefl keperluan pendaftaran wisuda dikirim
pengambilan sertifikat toefl,prosedur pengambilan sertifikat toefl
pengambilan sertifikat toefl,izin pengambilan sertifikat toefl ujian februari pengambilanya
pengambilan sertifikat toefl,madeline agustine tif terkait prosedur pengambilan sertifikat toefl prosedur pengambilan orang surat kuasa
pengambilan sertifikat toefl,pengambilan sertifikat toefl itp informasi blc sertifikat toefl diserahkan akademik fakultas mengambil sertifikat dikirimkan pos berdomisili diluar malang
pengambilan sertifikat toefl,madeline agustine tif terkait pengambilan sertifikat toefl jumat kemarin mengajukan tiket link dibuka linknya
surat pengantar penelitian skripsi,izin terkait pembuatan surat pengantar penelitian skripsi perusahaan prosesnya
surat pengantar penelitian skripsi,siang admin halofilkom surat pengantar penelitian skripsi bkpsdm kota malang amp disnaker mengontak whatsapp akademik tanggapan menghubungi halofilkom terkait mekanisme pengajuannya
surat aktif kuliah,pengajuan surat aktif kuliah butuh rekomendasi beasiswa
surat aktif kuliah,perihal surat aktif kuliah inputkan form nya minggu balasan nya email suratnya dikirim email ambil menginputkan google form nya form nya inputkan terinput
surat aktif kuliah,dibantu surat aktif kuliah
surat aktif kuliah,surat aktif kuliah
surat aktif kuliah,semester lupa mengajukan cuti status aktif sesuai baca website melanjutkan perkuliahan diharuskan mengajukan surat aktif kuliah format surat pengajuan memiliki surat prosedur diikuti mengumpulkan surat
surat aktif kuliah,prosedur surat aktif kuliah
surat aktif kuliah,terkait surat aktif kuliah
surat aktif kuliah,pengurusan surat aktif kuliah aktif link https
surat aktif kuliah,ijin prosedur pelayanan online mencetak surat aktif kuliah
surat aktif kuliah,permisi ijin bertanya jadi mengisi form pengajuan surat aktif kuliah surat aktif dikirimkan email kerja mengisi form tanggal maret menerima surat aktif kuliah solusinya
surat aktif kuliah,izin permohonan surat aktif kuliah daffa nabil hakim ajukan jumat maret email surat aktifnya
surat aktif kuliah,mengajukan cuti surat aktif kuliah surat keterangan
surat aktif kuliah,mengurus surat aktif kuliah pengurusan askes mengisi form rabu tanggal maret belom email informasi dibilang minimal kerja
surat aktif kuliah,formulir surat aktif kuliah ajukan
surat aktif kuliah,mengurus surat aktif kuliah
surat aktif kuliah,surat aktif kuliah keperluan tunjangan orang tua surat aktif kuliah
surat aktif kuliah,fayza sakina tif angkatan perihal pengajuan surat aktif kuliah semester surat aktif dikirimkan email
surat aktif kuliah,mengajukan surat aktif kuliah mengikuti tes toefl syarat pendaftaran wisuda memproses permohonan ajukan
surat aktif kuliah,apakan permohonan surat aktif kuliah nama anindya celena khansa kirana diproses
surat aktif kuliah,tim kemahaisiwaan  mengisi google form https surat aktif kuliah tanggal amp juli detail nama muhammad rafi fauzan fathinnim angkatan surat aktif kuliah diproses surat email terimakasihtertandarafi
surat aktif kuliah,mas dibantu surat aktif kuliah
surat aktif kuliah,izin surat aktif kuliah mengisi permohonan tanggal menerima diproses meletakkan alamat email yah
surat aktif kuliah,permisi mengisi form surat aktif kuliah kiriman mengisi seminggu
syarat menempuh mk lintas prodi,pembayaran angsuran maksimal dibayarkan tanggal agustus pembayaran angsuran dibayarkan maksimal semester ganjil pembayaran silahkan menghubungi halo filkom baik set ulang
perubahan judul skripsi filkom apps,berdasarkan aturan peroleh menerima menerima ukt mendaftar tanggal tgl februari filkom apps bukti diperiksa terkait data aturan peroleh dosen pembimbing mendaftar tgl februari memperoleh biaya ukt bantuan keuangan aturan nya ikuti biaya ukt nya sesuai aturan dimana membayar ukt
penambahan sks melebihi batas maksimum mk dari ip beban jtif,izin memproses krs semester memproses praktek kerja lapangan sks skripsi sks menyelesaikan pkl nilai pkl siam predikat semester melaksanakan seminar hasil kampus mengajar salah program kampus merdeka konversi sks sks sesuai arahan kaprodi tif meliputi diseminasi merdeka belajar sks komunikasi publik sks proyek mengajar sks konversi merdeka belajar tsb masuk krs praktek kerja lapangan skripsi proses krs hilang konfirmasi kaprodi tif tsb tsb krs cek khs nilai pkl nilainya predikat ketidakcocokan beban lulus khs sks beban beban khs tampil sesuai tambahan merdeka belajar nilai pkl nilai pkl hilang data sesuai arahannya
prasyarat perpindahan stream keminatan,akbar sesuai arahan kps tif untuk pengajuan transkrip final keperluan semhas skripsi progres bantuannya utk langsung dihapus pilihan nilai pcd nya utk keperluan kelengkapan folder drive yudisium maturnuwun nya
dosen pembimbing ujian skripsi tidak hadir salah satu,perkenalkan mohamad zakaria ansori sap jurusan  mengganggu nya izin terkait permintaan pembuatan surat keterangan expected menyelesaikan skripsi pelaksanaan ujian skripsi tanggal desember ujian apps pendaftaran kerja beasiswa melanjutkan studi negeri membutuhkan dokumen expected graduation salah persyaratan kegiatan informasi surat keterangan expected graduation informasinya
dosen pembimbing ujian skripsi tidak hadir salah satu,akademik perkenalkan aqmal maulana tisno  menempuh semester izin panduan pendaftaran semhas pengajuan semester skripsi daring izin surat edaran mengatakan pelaksanaan ujian skripsi luring izin syarat panduan semhas semester alurnya bantuannya arahannya berkenan
dosen pembimbing ujian skripsi tidak hadir salah satu,nama vicky melinda tanto  mengkonfirmasi mekanisme ujian skripsi diinformasikan dosen penguji pembimbing memiliki ujian skripsi luring daring mekanisme pelaksanaan ujian skripsi mengirimkan dokumen skripsi tercetak dosen penguji pembimbing pengujian perhatian ucapkan
dosen pembimbing ujian skripsi tidak hadir salah satu,terkait pelaksanaan ujian skripsi online karena email online link pertemuan nya apps pelaksanaan seminar hasil rabu jam pagi
dosen pembimbing ujian skripsi tidak hadir salah satu,pelaksanaan ujian skripsi dokumen sidang
 tombol revisi proposal skripsi pada filkom apps,perkenalkan mohamad ilham pratama elba wahid  daftar yudisium status sayang pada filkom apps penjadwalan yudisium langkah berikutnya lakukan isikan masuk peserta yudisium periode
skl  transkrip,permisi mengumpulkan surat pkl surat resmi terima pkl instansi mengikuti alur kirim melalui email indah cpnya berubah yusron yusron menyuruh mengirim email jurusan mengirim berkas kemana dosen pembimbing
pembayaran diluar jadwal registrasi,dear khrisna terkait pembayaran sisa tagihan diluar jadwal registrasi mengangsur menginfokan terkait tanggal pembayaran buka akses pembayarannya
pembayaran diluar jadwal registrasi,nama katriel manasye maynard jurusan  melapor kendala proses uang tagihan dikatakan teller bank bri nomor pembayaran diblokir ditutup membuka tiket half ilkom terkait balasannya sbb terkait pembayaran sisa tagihan diluar jadwal registrasi mengangsur menginfokan terkait tanggal pembayaran buka akses pembayarannya dibukakan teller bri nya pembayaran tanggal oktober pembayaran bank rupiah
pendaftaran yudisium filkom ub,deadline upload pendaftaran yudisium filkom apps for kemarin keterangan maksimal penyetorannya sidang skripsi tinggal menunggu hasil review jurnal jtiik tanggal kemarin status review
pendaftaran yudisium filkom ub,drop mata kuliah nilai rekap hasil studi siam keperluan pendaftaran yudisium filkom apps
pendaftaran yudisium filkom ub,izin terkait tagihan ukt muncul status mengajukan pendaftaran yudisium filkom apps status tertera penjadwalan yudisium berdasarkan informasi terima dinyatakan mendaftar yudisium otomatis blokir statusnya siam menghindari tagihan ukt bantuan arahannya terkait tagihan ukt input data menu yudisium siam
pendaftaran yudisium filkom ub,pendaftaran yudisium filkom apps tanggal januari kemarin
pendaftaran yudisium filkom ub,informasinya menyelesaikan pendaftaran yudisium filkom apps menunggu informasi perihal ukt akses upload berkas siam
pendaftaran yudisium filkom ub,thelemanica wicaksana tif validasi data lulusan siam diakses pendaftaran yudisium filkom apps januari kejelasan status siam berubah drop out
pendaftaran yudisium filkom ub,warahmatullahi wabarakatuh  admin halofilkom nama abdullah muhammad farouk hakim nim  status pendaftaran yudisium filkom apps pendaftaran yudisium filkom apps disetujui sekjur nama sikad nama ijazah screenshot surat pemberitahuannya alhamdulillah memperbaiki nama siakad menghubungi nama siam berubah sesuai ijazah lampirkan screenshot siam ijazah mengkonfirmasi perubahan akademik halofilkom topik bantuan akademik sesuai instruksi surat pemberitahuan dikonfirmasi nama siakad ijazah filkom apps status berubah verifikasi pendaftaran yudisium disetujui berkaitan pemberitahuan filkom apps proses revisi selesai tombol isian filkom apps  perhatiannya warahmatullahi wabarakatuh
pendaftaran yudisium filkom ub,pendaftaran yudisium filkom apps filkom apps status penjadwalan yudisium informasi upload berkas siam helpdesk yudisium terkendala siam layanan harap menghubungi keuangan fakultas permasalahan keuangan bantuannya
pendaftaran yudisium filkom ub,saya pendaftaran yudisium filkom apps nilai siam namun sampe nilai skripsi update disiram transkrip siapakah pendaftaran yudisium menunggu nilai skripsi siam
pendaftaran yudisium filkom ub,permisi pendaftaran yudisium filkom apps kelengkapan memiliki status diverifikasi diverifikasi proses verifikasi kelengkapan diverifikasi tombol daftar yudisium muncul kasih
pendaftaran yudisium filkom ub,yth admin halofilkom transkrip nilai mata kuliah induksi riset pendaftaran yudisium filkom apps mata kuliah nilai kecuali tugas perhatian bantuan admin ucapkan
pendaftaran yudisium filkom ub,perkenalkan aisyah angkatan melaporkan terkait ukt berubah semester memperoleh bidikmisi semester semester ukt senilai juta rupiah screenshot tagihan ukt semester kontrak bidikmisi selesai ukt semester juta rupiah ukt bayarkan juta rupiah screenshot tagihan ukt semester semester tagihan juta rupiah nilai kali lipat ukt edaran terkait pengurangan ukt mendaftarkan yudisium semester screenshot tagihan ukt semester semester menyelesaikan skripsi sidang semester ambil matkul skripsi persyaratan aktif pendaftaran yudisium screenshot bukti menyelesaikan skripsi pendaftaran yudisium filkom apps tolong dicek terkait tagihan ukt membayarkannya mendaftar yudisium
pendaftaran yudisium filkom ub,menyelesaikan skripsi januari pendaftaran yudisium filkom apps tanggal dikenakan biaya ukt edaran statusnya menunggu penjadwalan siam tagihan ukt nya persen yaa minggu tagihan bantuannya perhatiannya
pendaftaran yudisium filkom ub,assalamualaikum  izin perihal pendaftaran yudisium filkom apps halaman dinyatakan nilai rekap hasil studi final nilai pembatalan nilai pendaftaran yudisium mendaftar sidang transkrip nilai persyaratan sidang drop mata kuliah drop mata kuliah mengulang siam matkul drop transkrip nilai siam konfirmasi transkrip nilai mata kuliah siam transkrip pendaftaran yudisium salah  wassalamualaikum
pendaftaran yudisium filkom ub,izin pendaftaran yudisium filkom apps disana tertera syarat mendaftar status siam aktif nilai hasil rekap studi siam statusnya terdaftar rekap studi nilai skripsi tertulis lakukan mendaftar yudisium
pendaftaran yudisium filkom ub,permisi pendaftaran yudisium filkom apps mengisi google form di hari sabtu drive yudisium
pendaftaran yudisium filkom ub,muhammad eko lutfianto  izin mengajukan keluhan perihal progres verifikasi berkas yudisium upload dokumen lengkap jumat juli sesuai permintaan filkom apps proses pendaftaran yudisium terhitung agustus berkas disetujui antaran pas foto kartu tanda ijazah bukti bebas tanggungan perpustakaan teman upload berkas jumat sore harinya langsung diverifikasi diverifikasi jumat bantuannya kendala alami pendaftaran yudisium filkom apps siam
pendaftaran yudisium filkom ub,rizky septian damanik  izin mengajukan keluhan perihal verifikasi berkas yudisium upload dokumen lengkap sesuai permintaan filkom apps proses pendaftaran yudisium kamis juli terhitung agustus berkas disetujui antaran pas foto kartu tanda ijazah bukti bebas tanggungan perpustakaan teman upload berkas jumat sore harinya langsung diverifikasi bantuannya kendala alami pendaftaran yudisium filkom apps siam
permohonan perpanjangan mahasiswa do diluar skripsi,admin halo filkom krishna informatika angkatan sehubungan surat edaran direktur jenderal pendidikan nomor tanggal maret penyelenggaraan pembelajaran semester genap akademik mengajukan permohonan penambahan studi surat dilampirkan surat pernyataan penyelesaian studi semester ganjil surat pernyataan disetujui herman wakil dekan bidang akademik mengontak herman beliau bem memohon persetujuan tanda tangan beliau beliau membalas admin saran alternatif mesti lakukan
permohonan perpanjangan mahasiswa do diluar skripsi,menghubungi mengirimkan surat pernyataan orang tua wakil dekan bidang akademik kps ttd
permohonan perpanjangan mahasiswa do diluar skripsi,info mengirim surat wakil dekan bidang akademik format surat
permohonan perpanjangan mahasiswa do diluar skripsi,pembuatan suratnya format khususnya menghubungi wakil dekan bidang akademik
permohonan perpanjangan mahasiswa do diluar skripsi,semester berdasarkan pengumuman kemarin semester hybrid mengajukan keringanan masuk perkuliahan daring pembuatan suratnya format khususnya menghubungi wakil dekan bidang akademik
permohonan perpanjangan mahasiswa do diluar skripsi,tanda tangan wakil dekan bidang akademik langsung ruangan filenya dikirim via email dikirim via email tolong diberitahu emailnya
permohonan perpanjangan mahasiswa do diluar skripsi,dibagian unggah berkas berkasnya tanda tangan ketua program studi wakil dekan bidang akademik langsung dikirim tanda tangan tanda tangan dlu tanda tangan dikirim via langsung ruangan ketua program studi wakil dekan bidang akademik
pendataan kelas penuh,membuka formulir pendataan kelas penuh coba pakai email mendata
pendataan kelas penuh,mengambil matkul kelasnya penuh mendaftar pendataan kelas penuh tanggal terlewat dispensasi melunasi pembayaran ukt
pendataan kelas penuh,muhamad dafa hermawan  angkatan krs semester kebagian sks kelas pemrograman web pemrograman basis data mengambil kelas mata kuliah sesuai pedoman kurikulum  kuota kelas penuh mata kuliah ambil perancangan user experience data warehouse enterprise architecture perencanaan strategis  analisis desain  kewirausahaan mengisi form pendataan kelas penuh sks berkuliah semestinya malang urusan mengharuskan kampus kampus  perhatiannya
pendataan kelas penuh,elmifta yuana perwakilan kementrian advokesma bem tujuan terkait pendataan kelas penuh semester genap pendataan mengambil mata kuliah kelasnya penuh pendataan ditutup tanggal februari kabar terkait penambahan kelas kuota kelas terkait besok tanggal februari menambah mata kuliah kabar terkait pendataan
pendataan kelas penuh,hana rizkia pti angkatan rencananya menyusun krs isinya mata kuliah desain penelitian kuantitatif eksperimen bidang pendidikan manajemen sekolah laboratorium pembelajaran  manajemen proyek  manajemen produk kreatif bisnis  data warehouse pembelajaran interaktif realitas berimbuh maya siam menginputkan matakuliah matakuliah kelasnya penuh mengisi form pendataan kelas penuh mengisi krs kemarin solusinya
pendataan kelas penuh,pendataan kelas penuh pembayaran krsan siang mata kuliah ikuti penuh
pendataan kelas penuh,selamat malam perkenalkan nama daffario tif membayar ukt tanggal februari kelas mata kuliah keamanan informasi kewirausahaan stream interactive media instagram disana tertera pendataan kelas penuh tanggal februari mengikuti pendataan mata kuliah kewirausahaan pemrograman aplikasi perangkat bergerak solusinya
validasi krs jtif terlambat,dear firdaus sesuai arahan pimpinan pengajuan disetujui potongan tingkat
 kkn 2020,membaca persyaratan tata tertib uas salah satunya menyelesaikan persyaratan keuangan surat pernyataan membayar mengangsur terkait mekanisme format surat alamat pengiriman surat pernyataan
 kkn 2020,berterimakasih jawabannya kesalahan maksud mekanisme pengajuan surat pernyataan tertulis materai wakil dekan tanggal pembayaran ukt melebihi batas semester ganjil informasi dapatkan poin pengumuman tata tertib peserta ujian semester uas daring semester ganjil berkas foto lampirkan mengindikasikan berhak bantuan juta kemendikbud iya bantuan berlaku semester semester perhatian ucapkan
 kkn 2020,rafidah  angkatan izin tata tertib uas aturan wajib krs ktm ktm hilang
 kkn 2020,izin tata tertib pelaksanaan uas terkait poin dimana krs semester genap ktm krs hasil print siam ktm semester ktms
 kkn 2020,perkenalkan nama batara dolly nababan  angkatan sesuai pernyataan dekan  acara audiensi dewa ngoding diadakan rabu mei berhalangan uas luring menghubungi mengajukan uas online menghubungi memberitahu berhalangan hadir uas luring malang alasannya pkl di sekitar daerah domisili sumatera utara kota pematang siantar dilaksanakan tanggal juni dimana tanggal pklnya sesuai jadwal uts uas selesai tanggal juni berat pergi kemalang uas kota domisili melaksanakan pkl mengambil matakuliah semester utk mengikuti uas kota malang malang kota domisili membutuhkan memakan biaya akomodasi tinggal perjalanan memakan tenaga ditambah harga tiket pesawat melonjak kemalang minggu disana uas luring pertimbangan berat orangtua baca tata tertib uas online bedanya kelas memilih kuliah di malang orang tua membiayai akomodasi kost menjadi memberatkan orang tua pkl domisili malang minggu uas lampirkan bukti surat pkl berharap pengajuan maklumi dipahami mengikuti uas online berkenan
 kkn 2020,desy marinda oktavia sitinjak  angkatan sesuai pernyataan dekan  acara audiensi dewa ngoding berhalangan uas luring menghubungi mengajukan uas online menghubungi memberitahu berhalangan hadir uas luring malang alasannya pkl di sekitar daerah domisili sumatera utara kota pematang siantar dilaksanakan tanggal juni dimana tanggal pklnya sesuai jadwal uts uas selesai tanggal juni sulit pergi kemalang uas kota domisili melaksanakan pkl kota malang malang kota domisili membutuhkan biaya akomodasi biaya tinggal perjalanan memakan tenaga ditambah harga tiket pesawat melonjak kemalang minggu disana uas luring pertimbangan berat orangtua baca tata tertib uas online bedanya kelas memilih kuliah di malang orang tua membiayai akomodasi kost menjadi permasalahan orang tua pkl domisili malang minggu uas lampirkan bukti surat pkl berharap pengajuan maklumi dipahami mengikuti uas online berkenan
 kkn 2020,selamat malam permisi muhammad arkananta althaf  izin uas semester berdasarkan tata tertib lihat web uas dilaksanakan luring terpadu himpunan informatika hmif mengadakan survei uas dalamnya kesiapan pelaksanaan uas opsinya daring luring perubahan luring daring memilih daring luring luring booking kamar membayarnya sesuai batas ditentukan daring membayar tinggal ditunggu secepatnya tanggal mei batas pembayarannya memutuskan jam
 kkn 2020,permisi krs dibawa uas minggu krs dibawa ujian tertera tata tertib ujian poin print out bukti krs siam perangkat mobile tanda tangan dosen pengampu dosen pengampu sutrisno purnabakti tanda tangan dosen pengampu mengikuti ujian  tunggu jawabannya
 kkn 2020,tata tertib uas tertulis wajib krs semester genap krs dibawa bentuk fisik
 kkn 2020,rencana pembayaran sdra lakukan melebihi tanggal pelaksanaan uas dicermati diikuti poin nomor tata tertib laman https silahkan surat pernyataan tertulis ditandatangani wali meterai bersangkutan wakil dekan tanggal pembayaran ukt melebihi batas genap rencana tanggal nominal pembayaran
 kkn 2020,surat edaran kkn juni sosialisasi kkn juni juni pembekalan kkn diambil artikel https tata tertib salah komponen penilaian mengikuti pembekalan kkn tanggal nya sosialisasi diperbolehkan mengikuti acara sosialisasi tsb perjalanan malang tanggal
